<?xml version="1.0" encoding="UTF-8"?>
<!DOCTYPE manifesto SYSTEM "file:/Users/JoelRodrigues/Documents/MIEI/4Ano/1Semestre/DA_Web/2-TPC/manifesto.dtd">

<manifesto>
    <meta>
        <identificador>MIEI_2018_Web</identificador>
        <titulo>WebSite - Quran</titulo>
        <dinicio> 3 de outubro de 2018</dinicio>
        <dfim>8 de outubro de 2018</dfim>
        <supervisor>
            <nome url="http://www.di.uminho.pt/~jcr">José Carlos Ramalho</nome>
            <email>jcr@di.uminho.pt</email>
        </supervisor>
    </meta>
    <equipa>
        <membro>
            <identificador> a79068</identificador>
            <nome> Joel Soares Rodrigues</nome>
            <email> a79068@alunos.uminho.pt</email>
            <foto src="foto.JPG"/>
        </membro>
    </equipa>
    <resumo>
        <para>
            O objetivo deste trabalho era elaborar um <i>website</i> que traduzisse a informação presente num ficheiro <b>XML</b> proposto pela equipa docente que 
            resultaria da escolha de entre o livro do Alcorão e o livro de Mormon, neste caso foi selecionado o livro Alcorão.
        </para>
        <para>
            Numa primeira fase procedeu-se a um estudo prévido da estrutura do ficheiro fornecido, nomeadamente os elementos e informação relevante para passar para o <i>website</i>.
        </para>  
        <para>
            Tendo isto, foi implementado um ficheiro <b>XSLT</b> com o objetivo de definir a apresentação do ficheiro <b>XML</b> no <i>browser</i>. 
            Destaca-se ainda o uso de índices para manter a informação organizada. Isto é, cada capítulo do livro é traduzido numa página <i>web</i> e indexado ao índice de capítulos. É possível ainda navegar no <i>website</i> de forma a percorrer todos os capítulos desejados. 
            
        </para>
       
    </resumo>
    <resultados>
        <resultado url="website/index.html">WebSite Quran Book</resultado>
        <resultado url="quran.xsl">Quran xsl </resultado>
        <resultado url="manifesto-tp3.html">Manifesto html </resultado>
        <resultado url="manifesto-tp3.xml">Manifesto xml </resultado>
        <resultado url="manifesto-tp3.xsl">Manifesto xsl</resultado>
        <resultado url="quran.xml">Quran xml</resultado>
    </resultados>
</manifesto>
